{
  "schema_version": "0.1",
  "configuration_id": "dependency-expansion",
  "standard_version": "0.1.0-dev",
  "selected_profiles": [
    "foundation-baseline@0.1.0",
    "example-addon-requires-a@0.1.0"
  ],
  "accepted_nondefault_statuses": [],
  "notes": "Resolver should auto-add example-choice-a@0.1.0."
}
